Наушники проводные с микрофоном для телефона Pushbox Hoco M3,192064928,389 ₽,866 ₽,381 ₽,https://www.wildberries.ru/catalog/192064928/detail.aspx
Чехол для наушников.,12054742,99 ₽,999 ₽,97 ₽,https://www.wildberries.ru/catalog/12054742/detail.aspx
Чехол силиконовый на наушники Apple AirPods Max,230307475,276 ₽,1 200 ₽,270 ₽,https://www.wildberries.ru/catalog/230307475/detail.aspx
Чехол силиконовый на наушники Apple AirPods Max,230307470,276 ₽,1 200 ₽,270 ₽,https://www.wildberries.ru/catalog/230307470/detail.aspx
Чехол силиконовый на наушники Apple AirPods Max,230307479,264 ₽,1 200 ₽,258 ₽,https://www.wildberries.ru/catalog/230307479/detail.aspx
Наушники проводные с микрофоном,180048545,260 ₽,520 ₽,254 ₽,https://www.wildberries.ru/catalog/180048545/detail.aspx
Наушники беспроводные AirPods Pro 2 для iPhone Android,229524197,1 127 ₽,9 700 ₽,1 104 ₽,https://www.wildberries.ru/catalog/229524197/detail.aspx
Наушники беспроводные Airpods 3 для iPhone и android,194457685,1 161 ₽,7 777 ₽,1 137 ₽,https://www.wildberries.ru/catalog/194457685/detail.aspx
"Наушники кабель 5 метров 3,5 мм для просмотра ТВ компьютера",16704900,523 ₽,830 ₽,512 ₽,https://www.wildberries.ru/catalog/16704900/detail.aspx
Беспроводные наушники Bluetooth с шумоподавлением,184521143,1 762 ₽,5 897 ₽,1 726 ₽,https://www.wildberries.ru/catalog/184521143/detail.aspx
Держатель для наушников на стол,309187828,347 ₽,590 ₽,340 ₽,https://www.wildberries.ru/catalog/309187828/detail.aspx
Чехол на airpods 3 для беспроводных наушников аирподс,152032901,352 ₽,2 799 ₽,344 ₽,https://www.wildberries.ru/catalog/152032901/detail.aspx
Чехол для Samsung Galaxy Buds 2 / Pro / Pro 2 / Live / FE,48105130,319 ₽,507 ₽,312 ₽,https://www.wildberries.ru/catalog/48105130/detail.aspx
"Гарнитура для рации Motorola, наушники для рации Motorola",143759522,527 ₽,1 198 ₽,516 ₽,https://www.wildberries.ru/catalog/143759522/detail.aspx
"Наушники проводные с микрофоном для телефона 3,5 Jack",181640549,197 ₽,460 ₽,193 ₽,https://www.wildberries.ru/catalog/181640549/detail.aspx
Чехол для Apple Airpods Pro,115496505,205 ₽,500 ₽,200 ₽,https://www.wildberries.ru/catalog/115496505/detail.aspx
Наушники беспроводные большие iphone для андроид,223902954,1 190 ₽,2 759 ₽,1 166 ₽,https://www.wildberries.ru/catalog/223902954/detail.aspx
Чехол для AirPods,48104916,383 ₽,644 ₽,375 ₽,https://www.wildberries.ru/catalog/48104916/detail.aspx
Чехол силиконовый на наушники Apple AirPods Max,230307466,276 ₽,1 200 ₽,270 ₽,https://www.wildberries.ru/catalog/230307466/detail.aspx
Наушники с микрофоном для iPhone,254252272,734 ₽,1 302 ₽,719 ₽,https://www.wildberries.ru/catalog/254252272/detail.aspx
Чехол на Airpods 3 прозрачный,119978299,174 ₽,460 ₽,170 ₽,https://www.wildberries.ru/catalog/119978299/detail.aspx
Наушники JBL 110: легендарное качество для каждого,92048900,617 ₽,1 199 ₽,604 ₽,https://www.wildberries.ru/catalog/92048900/detail.aspx
Чехол для Samsung Galaxy Buds 2 / Pro / Pro 2 / Live / FE,35083157,318 ₽,505 ₽,311 ₽,https://www.wildberries.ru/catalog/35083157/detail.aspx
Наушники беспроводные на андроид и iPhone,262531728,1 160 ₽,1 998 ₽,1 136 ₽,https://www.wildberries.ru/catalog/262531728/detail.aspx
Наушники беспроводные блютуз для iPhone и на Андроид,269828534,1 120 ₽,1 350 ₽,1 097 ₽,https://www.wildberries.ru/catalog/269828534/detail.aspx
Наушники беспроводные Airpods 3 для iPhone и android,250133041,1 528 ₽,10 830 ₽,1 497 ₽,https://www.wildberries.ru/catalog/250133041/detail.aspx
"Наушники проводные с микрофоном для телефона 3,5 Jack",54581483,196 ₽,469 ₽,192 ₽,https://www.wildberries.ru/catalog/54581483/detail.aspx
Наушники проводные с микрофоном для телефона и компьютера,222807040,976 ₽,2 352 ₽,956 ₽,https://www.wildberries.ru/catalog/222807040/detail.aspx
Чехол силиконовый на наушники Apple AirPods Max,230307468,276 ₽,1 200 ₽,270 ₽,https://www.wildberries.ru/catalog/230307468/detail.aspx
Наушники беспроводные AirPods 2,132239674,1 214 ₽,9 753 ₽,1 189 ₽,https://www.wildberries.ru/catalog/132239674/detail.aspx
Чехол для наушников AirPods 3,222347531,238 ₽,700 ₽,233 ₽,https://www.wildberries.ru/catalog/222347531/detail.aspx
Наушники проводные внутриканальные с гарнитурой Jack 3.5 мм,217311972,117 ₽,250 ₽,114 ₽,https://www.wildberries.ru/catalog/217311972/detail.aspx
Подставка держатель для наушников,211488163,443 ₽,759 ₽,434 ₽,https://www.wildberries.ru/catalog/211488163/detail.aspx
Игровые наушники для ПК с микрофоном PANTEON GHP-770 PRO,163837224,2 899 ₽,5 635 ₽,2 841 ₽,https://www.wildberries.ru/catalog/163837224/detail.aspx
Наушники беспроводные спортивные OpenAir Arc,210598515,1 611 ₽,4 164 ₽,1 578 ₽,https://www.wildberries.ru/catalog/210598515/detail.aspx
Чехол силиконовый на наушники Apple AirPods Max,230307472,276 ₽,1 200 ₽,270 ₽,https://www.wildberries.ru/catalog/230307472/detail.aspx
Чехол силиконовый на наушники Apple AirPods Max,230307462,276 ₽,1 200 ₽,270 ₽,https://www.wildberries.ru/catalog/230307462/detail.aspx
Игровые наушники с микрофоном для ПК PANTEON GHP-270,170462183,1 403 ₽,2 415 ₽,1 374 ₽,https://www.wildberries.ru/catalog/170462183/detail.aspx
Наушники беспроводные с микрофоном блютуз Pro2,261918617,1 053 ₽,2 951 ₽,1 031 ₽,https://www.wildberries.ru/catalog/261918617/detail.aspx
Наушники беспроводные с шумоподавлением Pro 2 iPhone Android,303011737,1 726 ₽,8 000 ₽,1 691 ₽,https://www.wildberries.ru/catalog/303011737/detail.aspx
Гарнитура беспроводная tune 510bt черный,177884519,5 129 ₽,8 466 ₽,5 026 ₽,https://www.wildberries.ru/catalog/177884519/detail.aspx
A.Pods Pro 2 наушники беспроводные,240122176,1 245 ₽,7 500 ₽,1 220 ₽,https://www.wildberries.ru/catalog/240122176/detail.aspx
"Наушники с микрофоном Jack 3,5",16530335,296 ₽,823 ₽,290 ₽,https://www.wildberries.ru/catalog/16530335/detail.aspx
Наушники беспроводные большие с микрофоном и шумоподавлением,286569086,2 061 ₽,4 968 ₽,2 019 ₽,https://www.wildberries.ru/catalog/286569086/detail.aspx
Чехол силиконовый на наушники Apple AirPods Max,230307490,420 ₽,1 200 ₽,411 ₽,https://www.wildberries.ru/catalog/230307490/detail.aspx
Проводные вакуумные наушники Borofone BM75,202868704,236 ₽,550 ₽,231 ₽,https://www.wildberries.ru/catalog/202868704/detail.aspx
Наушники беспроводные Pro 2 Premium NEW-2024 iPhone-Android,264347015,763 ₽,1 999 ₽,747 ₽,https://www.wildberries.ru/catalog/264347015/detail.aspx
Наушники проводные Pushbox Hoco M3 с микрофоном для телефона,205996066,404 ₽,898 ₽,395 ₽,https://www.wildberries.ru/catalog/205996066/detail.aspx
Чехол для Airpods 4,293784184,200 ₽,500 ₽,196 ₽,https://www.wildberries.ru/catalog/293784184/detail.aspx
Наушники беспроводные Ai.Pods Pro 2 для iPhone и Android,246256245,1 186 ₽,17 875 ₽,1 162 ₽,https://www.wildberries.ru/catalog/246256245/detail.aspx
Наушники беспроводные A.Pods PRO 2 для iPhone и Android,168680999,1 169 ₽,9 390 ₽,1 145 ₽,https://www.wildberries.ru/catalog/168680999/detail.aspx
Наушники беспроводные с дисплеем для iPhone Android,273732156,1 424 ₽,6 599 ₽,1 395 ₽,https://www.wildberries.ru/catalog/273732156/detail.aspx
Беспроводные наушники блютуз Air 3 с микрофоном,254602900,986 ₽,1 917 ₽,966 ₽,https://www.wildberries.ru/catalog/254602900/detail.aspx
Наушники беспроводные Air 2 для iPhone и Android,150571491,1 037 ₽,2 500 ₽,1 016 ₽,https://www.wildberries.ru/catalog/150571491/detail.aspx
Чехол силиконовый на наушники Apple AirPods Max,230307469,276 ₽,1 200 ₽,270 ₽,https://www.wildberries.ru/catalog/230307469/detail.aspx
Чехол силиконовый на наушники Apple AirPods Max,230307484,276 ₽,1 200 ₽,270 ₽,https://www.wildberries.ru/catalog/230307484/detail.aspx
Чехол для AirPods 3,76934580,383 ₽,644 ₽,375 ₽,https://www.wildberries.ru/catalog/76934580/detail.aspx
Беспроводные наушники для iPhone и Android,290400266,633 ₽,2 963 ₽,620 ₽,https://www.wildberries.ru/catalog/290400266/detail.aspx
Наушники проводные с микрофоном,148734350,491 ₽,790 ₽,481 ₽,https://www.wildberries.ru/catalog/148734350/detail.aspx
Наушники беспроводные для андроид iphone блютуз с микрофоном,305712162,959 ₽,2 890 ₽,939 ₽,https://www.wildberries.ru/catalog/305712162/detail.aspx
Силиконовые амбушюры сменные комплект 3 размера,198422350,162 ₽,200 ₽,158 ₽,https://www.wildberries.ru/catalog/198422350/detail.aspx
Микронаушник для экзамена Premium PRO с пищалкой капсульный,193112311,3 137 ₽,5 400 ₽,3 074 ₽,https://www.wildberries.ru/catalog/193112311/detail.aspx
Наушники беспроводные Air 2 для iPhone и Android,220510111,654 ₽,2 718 ₽,640 ₽,https://www.wildberries.ru/catalog/220510111/detail.aspx
Внутриканальные проводные наушники HV-705 grey,277700664,612 ₽,1 190 ₽,599 ₽,https://www.wildberries.ru/catalog/277700664/detail.aspx
Наушники проводные для телефона,265305143,349 ₽,1 440 ₽,342 ₽,https://www.wildberries.ru/catalog/265305143/detail.aspx
Наушники PRO с шумоподавлением проводные для iPhone,186900067,739 ₽,1 350 ₽,724 ₽,https://www.wildberries.ru/catalog/186900067/detail.aspx
"Беспроводные накладные наушники с шумоподавлением, HB-715",52205617,2 678 ₽,5 290 ₽,2 624 ₽,https://www.wildberries.ru/catalog/52205617/detail.aspx
Беспроводные наушники для телефона с микрофоном спортивные,142996490,876 ₽,1 790 ₽,858 ₽,https://www.wildberries.ru/catalog/142996490/detail.aspx
Наушники проводные с микрофоном вакуумные T110,143211912,476 ₽,5 218 ₽,466 ₽,https://www.wildberries.ru/catalog/143211912/detail.aspx
Силиконовый чехол на AirPods 1/2 с карабином,223227828,446 ₽,1 139 ₽,437 ₽,https://www.wildberries.ru/catalog/223227828/detail.aspx
Силиконовый чехол на AirPods Pro с карабином,223214388,398 ₽,999 ₽,390 ₽,https://www.wildberries.ru/catalog/223214388/detail.aspx
Наушники беспроводные,277083388,1 801 ₽,7 000 ₽,1 764 ₽,https://www.wildberries.ru/catalog/277083388/detail.aspx
Накладки на наушники для Airpods 3 Secure Fit,168927807,1 327 ₽,2 490 ₽,1 300 ₽,https://www.wildberries.ru/catalog/168927807/detail.aspx
Наушники беспроводные Air Pro для iPhone и Android,184042303,1 003 ₽,8 300 ₽,982 ₽,https://www.wildberries.ru/catalog/184042303/detail.aspx
Наушники проводные большие для ПК Panteon GHP-180,42617645,1 207 ₽,1 915 ₽,1 182 ₽,https://www.wildberries.ru/catalog/42617645/detail.aspx
Наушники беспроводные AirPro 2 black для iPhone Android,232696492,1 327 ₽,1 999 ₽,1 300 ₽,https://www.wildberries.ru/catalog/232696492/detail.aspx
"Беспроводные наушники Bluetooth 5.1 с микрофоном, HB-413",48870965,1 175 ₽,2 890 ₽,1 151 ₽,https://www.wildberries.ru/catalog/48870965/detail.aspx
"Игровые наушники с виртуальной картой и подсветкой, GHS-X15",9968887,1 530 ₽,4 390 ₽,1 499 ₽,https://www.wildberries.ru/catalog/9968887/detail.aspx
Наушники проводные для телефона,262031942,349 ₽,1 440 ₽,342 ₽,https://www.wildberries.ru/catalog/262031942/detail.aspx
"Наушники беспроводные Bluetooth 5.1 ANC, HB-707",153793285,1 688 ₽,3 990 ₽,1 654 ₽,https://www.wildberries.ru/catalog/153793285/detail.aspx
Чехол силиконовый на наушники Apple AirPods Max,230307477,276 ₽,1 200 ₽,270 ₽,https://www.wildberries.ru/catalog/230307477/detail.aspx
Беспроводные наушники с напальчниками для мобильных игр,199573766,683 ₽,1 915 ₽,669 ₽,https://www.wildberries.ru/catalog/199573766/detail.aspx
"Беспроводные наушники Bluetooth 5.0 с микрофоном, HB-412",48866033,1 012 ₽,2 490 ₽,991 ₽,https://www.wildberries.ru/catalog/48866033/detail.aspx
Игровые наушники проводные для ПК PANTEON GHP-970 PRO,231721760,3 037 ₽,6 000 ₽,2 976 ₽,https://www.wildberries.ru/catalog/231721760/detail.aspx
Наушники беспроводные xiaomi redmi airdots с микрофоном,171064186,691 ₽,10 413 ₽,677 ₽,https://www.wildberries.ru/catalog/171064186/detail.aspx
Наушники беспроводные Airpods 2 для iPhone и Android,162466293,1 523 ₽,11 470 ₽,1 492 ₽,https://www.wildberries.ru/catalog/162466293/detail.aspx
Чехол для AirPods Pro 2,164065976,365 ₽,3 070 ₽,357 ₽,https://www.wildberries.ru/catalog/164065976/detail.aspx
Чехол для Samsung Galaxy Buds 2 / Pro / Pro 2 / Live / FE,35083158,336 ₽,534 ₽,329 ₽,https://www.wildberries.ru/catalog/35083158/detail.aspx
Беспроводные наушники блютуз Air Pro с микрофоном,256524549,1 013 ₽,1 970 ₽,992 ₽,https://www.wildberries.ru/catalog/256524549/detail.aspx
Наушники беспроводные сенсорные для телефона,317569899,612 ₽,10 543 ₽,599 ₽,https://www.wildberries.ru/catalog/317569899/detail.aspx
"Беспроводные наушники Bluetooth 5.1 с микрофоном, HB-413",48870964,1 007 ₽,2 890 ₽,986 ₽,https://www.wildberries.ru/catalog/48870964/detail.aspx
"Наушники TWS / Bluetooth 5.0, Harper HB-532",136140650,927 ₽,2 190 ₽,908 ₽,https://www.wildberries.ru/catalog/136140650/detail.aspx
"Наушники беспроводные Bluetooth 5.1, HB-707",79984625,1 688 ₽,3 990 ₽,1 654 ₽,https://www.wildberries.ru/catalog/79984625/detail.aspx
Чехол для наушников AirPods Pro2,263327463,306 ₽,1 000 ₽,299 ₽,https://www.wildberries.ru/catalog/263327463/detail.aspx
Чехол для наушников AirPods 3 с брелком,198112643,380 ₽,1 395 ₽,372 ₽,https://www.wildberries.ru/catalog/198112643/detail.aspx
Чехол силиконовый на наушники Apple AirPods Max,230307474,276 ₽,1 200 ₽,270 ₽,https://www.wildberries.ru/catalog/230307474/detail.aspx
"Чехол AirPods Pro, AirPods Pro 2, Hoco EW04, Dsaila Pro",301465822,1 139 ₽,2 857 ₽,1 116 ₽,https://www.wildberries.ru/catalog/301465822/detail.aspx
Чехол силиконовый на наушники Apple AirPods Max,230307471,276 ₽,1 200 ₽,270 ₽,https://www.wildberries.ru/catalog/230307471/detail.aspx
"Наушники TWS / Bluetooth 5.0, Harper HB-532",136140665,1 108 ₽,2 190 ₽,1 085 ₽,https://www.wildberries.ru/catalog/136140665/detail.aspx
Беспроводные наушники Bluetooth,190312479,605 ₽,7 300 ₽,592 ₽,https://www.wildberries.ru/catalog/190312479/detail.aspx
Подставка держатель для наушников,211488164,459 ₽,757 ₽,449 ₽,https://www.wildberries.ru/catalog/211488164/detail.aspx
Беспроводные вакуумные наушники блютуз,186737588,637 ₽,2 400 ₽,624 ₽,https://www.wildberries.ru/catalog/186737588/detail.aspx
"Беспроводные наушники Bluetooth, HB-213",16482337,981 ₽,2 190 ₽,961 ₽,https://www.wildberries.ru/catalog/16482337/detail.aspx
"Беспроводные наушники Bluetooth 5.0 с микрофоном, HB-412",48866035,1 012 ₽,2 490 ₽,991 ₽,https://www.wildberries.ru/catalog/48866035/detail.aspx
Наушники проводные с микрофоном,305619960,280 ₽,1 002 ₽,274 ₽,https://www.wildberries.ru/catalog/305619960/detail.aspx
"Беспроводные наушники Bluetooth 5.0 с микрофоном, HB-412",48866034,1 012 ₽,2 490 ₽,991 ₽,https://www.wildberries.ru/catalog/48866034/detail.aspx
Наушники беспроводные AirPro 2 для iPhone Android,209928876,1 161 ₽,1 999 ₽,1 137 ₽,https://www.wildberries.ru/catalog/209928876/detail.aspx
"Беспроводные MP3 наушники Bluetooth 5.0, HB-212 green",16482340,890 ₽,2 190 ₽,872 ₽,https://www.wildberries.ru/catalog/16482340/detail.aspx
"Беспроводные Bluetooth 5.0 наушники, HB-712",50394539,2 110 ₽,5 190 ₽,2 067 ₽,https://www.wildberries.ru/catalog/50394539/detail.aspx
Проводные наушники MDR-EX15LP. Оригинал. Вьетнам.,160962221,1 214 ₽,1 590 ₽,1 189 ₽,https://www.wildberries.ru/catalog/160962221/detail.aspx
"Детские проводные наушники со сменными раскрасками, HN-302",14793474,965 ₽,1 790 ₽,945 ₽,https://www.wildberries.ru/catalog/14793474/detail.aspx
Наушники беспроводные Air Pro для iPhone и Android блютуз,151264534,846 ₽,8 499 ₽,829 ₽,https://www.wildberries.ru/catalog/151264534/detail.aspx
"Наушники беспроводные TWS, модель HB-555",64981674,2 019 ₽,4 590 ₽,1 978 ₽,https://www.wildberries.ru/catalog/64981674/detail.aspx
Наушники беспроводные A.Pods2 для iPhone Android,205447945,763 ₽,1 999 ₽,747 ₽,https://www.wildberries.ru/catalog/205447945/detail.aspx
Наушники проводные с микрофоном Type-c,217301841,298 ₽,850 ₽,292 ₽,https://www.wildberries.ru/catalog/217301841/detail.aspx
Чехол для AirPods Pro,236719959,965 ₽,1 603 ₽,945 ₽,https://www.wildberries.ru/catalog/236719959/detail.aspx
"Наушники внутриканальные детские, модель HK-39",48848982,289 ₽,590 ₽,283 ₽,https://www.wildberries.ru/catalog/48848982/detail.aspx
"Детские проводные наушники со сменными раскрасками, HN-302",14793475,1 039 ₽,1 790 ₽,1 018 ₽,https://www.wildberries.ru/catalog/14793475/detail.aspx
Амбушюры JBL Sony,254457624,254 ₽,520 ₽,248 ₽,https://www.wildberries.ru/catalog/254457624/detail.aspx
Чехол для Samsung Galaxy Buds 2 / Pro / Pro 2 / Live / FE,43373928,336 ₽,534 ₽,329 ₽,https://www.wildberries.ru/catalog/43373928/detail.aspx
Силиконовые амбушюры сменные комплект 3 размера,198423542,162 ₽,200 ₽,158 ₽,https://www.wildberries.ru/catalog/198423542/detail.aspx
Наушники беспроводные Airpods Pro 2 реплика c микрофоном,239419435,2 050 ₽,10 740 ₽,2 009 ₽,https://www.wildberries.ru/catalog/239419435/detail.aspx
Беспроводные наушники WH-CH720 Оригинал,189316718,11 836 ₽,21 940 ₽,11 599 ₽,https://www.wildberries.ru/catalog/189316718/detail.aspx
Наушники беспроводные детские большие накладные с микрофоном,181154776,2 234 ₽,8 010 ₽,2 189 ₽,https://www.wildberries.ru/catalog/181154776/detail.aspx
"Амбушюры для наушников Bose QC15, QC25 (Натуральная кожа)",221997579,1 501 ₽,1 990 ₽,1 470 ₽,https://www.wildberries.ru/catalog/221997579/detail.aspx
Силиконовый чехол бордовый для AirPods Pro,259931628,277 ₽,448 ₽,271 ₽,https://www.wildberries.ru/catalog/259931628/detail.aspx
Проводные наушники с микрофоном MDR-EX15АP. Оригинал.,168766548,1 239 ₽,1 890 ₽,1 214 ₽,https://www.wildberries.ru/catalog/168766548/detail.aspx
Наушники проводные Lightning с микрофоном,190443909,260 ₽,400 ₽,254 ₽,https://www.wildberries.ru/catalog/190443909/detail.aspx
Наушники беспроводные большие iphone для андроид телевизора,200171680,1 294 ₽,2 999 ₽,1 268 ₽,https://www.wildberries.ru/catalog/200171680/detail.aspx
Наушники Bluetooth беспроводные накладные HB-215 red,291849940,1 292 ₽,2 290 ₽,1 266 ₽,https://www.wildberries.ru/catalog/291849940/detail.aspx
Наушники беспроводные AirPods 3 для iPhone и Android,216296339,1 220 ₽,7 000 ₽,1 195 ₽,https://www.wildberries.ru/catalog/216296339/detail.aspx
Наушники Bluetooth беспроводные накладные HB-215 blue,291852228,1 254 ₽,2 290 ₽,1 228 ₽,https://www.wildberries.ru/catalog/291852228/detail.aspx
Чехол для Samsung Galaxy Buds 2 / Pro / Pro 2 / Live / FE,35083160,270 ₽,429 ₽,264 ₽,https://www.wildberries.ru/catalog/35083160/detail.aspx
Беспроводные наушники NGB для iphone и android,199692902,1 553 ₽,5 199 ₽,1 521 ₽,https://www.wildberries.ru/catalog/199692902/detail.aspx
Наушники беспроводные Airpods pro 2 для iPhone и Android,152560914,2 096 ₽,10 980 ₽,2 054 ₽,https://www.wildberries.ru/catalog/152560914/detail.aspx
Беспроводные наушники для iPhone и Android,234078420,382 ₽,2 500 ₽,374 ₽,https://www.wildberries.ru/catalog/234078420/detail.aspx
Наушники беспроводные A. Pods Pro 2 для iPhone Android,290916842,2 107 ₽,5 520 ₽,2 064 ₽,https://www.wildberries.ru/catalog/290916842/detail.aspx
Наушники беспроводные игровые для iphone и андроид,240725355,799 ₽,1 999 ₽,783 ₽,https://www.wildberries.ru/catalog/240725355/detail.aspx
Микронаушник магнитный кабель,316119121,279 ₽,500 ₽,273 ₽,https://www.wildberries.ru/catalog/316119121/detail.aspx
PANTEON GHP-970 W BT Black-Red Игровые наушники,272697850,5 561 ₽,10 000 ₽,5 449 ₽,https://www.wildberries.ru/catalog/272697850/detail.aspx
Наушники беспроводные Galaxy Buds Pro,257860914,776 ₽,1 990 ₽,760 ₽,https://www.wildberries.ru/catalog/257860914/detail.aspx
"Игровые наушники Gaming Mirro, GHS-R100",11008097,1 164 ₽,3 190 ₽,1 140 ₽,https://www.wildberries.ru/catalog/11008097/detail.aspx
Беспроводные вакуумные наушники блютуз с шумоподавлением,226478179,281 ₽,1 490 ₽,275 ₽,https://www.wildberries.ru/catalog/226478179/detail.aspx
Чехол Elago для AirPods Waterproof hang case Nightglow blue,5738811,1 011 ₽,2 190 ₽,990 ₽,https://www.wildberries.ru/catalog/5738811/detail.aspx
Наушники беспроводные для iPhone и Android,77045756,377 ₽,5 999 ₽,369 ₽,https://www.wildberries.ru/catalog/77045756/detail.aspx
Наушники проводные с микрофоном JBL 110,93439356,577 ₽,1 199 ₽,565 ₽,https://www.wildberries.ru/catalog/93439356/detail.aspx
Наушники беспроводные AirPro 2 для iPhone Android,192097894,830 ₽,9 100 ₽,813 ₽,https://www.wildberries.ru/catalog/192097894/detail.aspx
Беспроводные наушники игровые ENC HB-575,65073266,3 294 ₽,7 490 ₽,3 228 ₽,https://www.wildberries.ru/catalog/65073266/detail.aspx
"Детские проводные наушники со сменными раскрасками, HN-302",14793476,841 ₽,1 690 ₽,824 ₽,https://www.wildberries.ru/catalog/14793476/detail.aspx
Кронштейн для наушников (Белый),187296288,217 ₽,250 ₽,212 ₽,https://www.wildberries.ru/catalog/187296288/detail.aspx
Наушники беспроводные с микрофоном Pro3 Android iphone,145726284,1 408 ₽,2 978 ₽,1 379 ₽,https://www.wildberries.ru/catalog/145726284/detail.aspx
Наушники беспроводные с дисплеем Apods для iPhone Android,230075974,2 102 ₽,7 915 ₽,2 059 ₽,https://www.wildberries.ru/catalog/230075974/detail.aspx
