Название товара,Артикул,Цена,Цена без скидки,Цена с картой WB,Ссылка
Наушники беспроводные Air 3 для iPhone Android,182899576,1 418 ₽,2 999 ₽,1 389 ₽,https://www.wildberries.ru/catalog/182899576/detail.aspx
Силиконовый чехол для AirPods 4,294665308,250 ₽,965 ₽,245 ₽,https://www.wildberries.ru/catalog/294665308/detail.aspx
Наушники беспроводные с микрофоном EQ2 Plus,297014891,858 ₽,2 350 ₽,840 ₽,https://www.wildberries.ru/catalog/297014891/detail.aspx
Беспроводные наушники NGB для iphone и android,181654788,2 469 ₽,6 199 ₽,2 419 ₽,https://www.wildberries.ru/catalog/181654788/detail.aspx
Беспроводные наушники,251837288,1 244 ₽,2 999 ₽,1 219 ₽,https://www.wildberries.ru/catalog/251837288/detail.aspx
Наушники беспроводные большие с микрофоном и RGB подсветкой,75913097,875 ₽,2 110 ₽,857 ₽,https://www.wildberries.ru/catalog/75913097/detail.aspx
Наушники беспроводные большие с микрофоном и шумоподавлением,197310190,956 ₽,2 306 ₽,936 ₽,https://www.wildberries.ru/catalog/197310190/detail.aspx
Наушники проводные с микрофоном большие игровые для пк,170868893,1 260 ₽,3 038 ₽,1 234 ₽,https://www.wildberries.ru/catalog/170868893/detail.aspx
Беспроводные наушники NGB для iphone и android,209039103,2 675 ₽,6 199 ₽,2 621 ₽,https://www.wildberries.ru/catalog/209039103/detail.aspx
Микронаушник капсульный для экзамена с пищалкой,90225864,2 610 ₽,4 430 ₽,2 557 ₽,https://www.wildberries.ru/catalog/90225864/detail.aspx
"Наушники беспроводные Airpods 2 копия для iPhone,Android",281158165,1 527 ₽,9 199 ₽,1 496 ₽,https://www.wildberries.ru/catalog/281158165/detail.aspx
Беспроводные наушники спортивные с микрофоном,180758632,1 626 ₽,4 000 ₽,1 593 ₽,https://www.wildberries.ru/catalog/180758632/detail.aspx
Наушники беспроводные большие с микрофоном и шумоподавлением,197310344,1 092 ₽,2 632 ₽,1 070 ₽,https://www.wildberries.ru/catalog/197310344/detail.aspx
Наушники беспроводные с микрофоном для Android и Iphone,185063693,692 ₽,3 339 ₽,678 ₽,https://www.wildberries.ru/catalog/185063693/detail.aspx
Наушники беспроводные с микрофоном EQ2 TWS,289952998,730 ₽,1 999 ₽,715 ₽,https://www.wildberries.ru/catalog/289952998/detail.aspx
Большие беспроводные наушники с шумоподавлением,182640514,6 465 ₽,19 000 ₽,6 335 ₽,https://www.wildberries.ru/catalog/182640514/detail.aspx
Микронаушник капсульный для экзамена,45719908,2 388 ₽,3 888 ₽,2 340 ₽,https://www.wildberries.ru/catalog/45719908/detail.aspx
Беспроводные Наушники Air 2 на iPhone и Android,278342167,647 ₽,1 599 ₽,634 ₽,https://www.wildberries.ru/catalog/278342167/detail.aspx
Гарнитура блютуз для телефона водителю,309445869,1 651 ₽,1 990 ₽,1 617 ₽,https://www.wildberries.ru/catalog/309445869/detail.aspx
Гарнитура блютуз для телефона водителю,295840536,2 315 ₽,3 770 ₽,2 268 ₽,https://www.wildberries.ru/catalog/295840536/detail.aspx
Наушники беспроводные большие с микрофоном и шумоподавлением,280464248,1 577 ₽,3 800 ₽,1 545 ₽,https://www.wildberries.ru/catalog/280464248/detail.aspx
Наушники беспроводные спортивные с шумоподавлением,172931316,1 254 ₽,3 024 ₽,1 228 ₽,https://www.wildberries.ru/catalog/172931316/detail.aspx
Наушники беспроводные игровые Bluetooth 5.3,134131483,1 858 ₽,7 999 ₽,1 820 ₽,https://www.wildberries.ru/catalog/134131483/detail.aspx
Наушники беспроводные Bluetooth с микрофоном,277779422,1 191 ₽,2 990 ₽,1 167 ₽,https://www.wildberries.ru/catalog/277779422/detail.aspx
"Микронаушник капсульный Lite K5 6 мм, капсула без гарнитуры",85655387,1 850 ₽,2 533 ₽,1 813 ₽,https://www.wildberries.ru/catalog/85655387/detail.aspx
Игровые наушники,291147543,2 531 ₽,6 100 ₽,2 480 ₽,https://www.wildberries.ru/catalog/291147543/detail.aspx
Микронаушник магнитный для экзамена с пищалкой проводной,45063542,1 692 ₽,2 793 ₽,1 658 ₽,https://www.wildberries.ru/catalog/45063542/detail.aspx
Galaxy Buds Pro PREMIUM,151651666,1 230 ₽,9 880 ₽,1 205 ₽,https://www.wildberries.ru/catalog/151651666/detail.aspx
Наушники беспроводные большие с микрофоном и шумоподавлением,227884392,937 ₽,2 258 ₽,918 ₽,https://www.wildberries.ru/catalog/227884392/detail.aspx
Наушники беспроводные для iPhone и Android,66783447,673 ₽,2 080 ₽,659 ₽,https://www.wildberries.ru/catalog/66783447/detail.aspx
Наушники беспроводные Pods Pro 2,197349073,1 128 ₽,1 999 ₽,1 105 ₽,https://www.wildberries.ru/catalog/197349073/detail.aspx
Наушники беспроводные AirPro i65 для iPhone Android,285411032,1 805 ₽,2 995 ₽,1 768 ₽,https://www.wildberries.ru/catalog/285411032/detail.aspx
Наушники беспроводные для Айфон и Андроид,205483688,1 037 ₽,2 975 ₽,1 016 ₽,https://www.wildberries.ru/catalog/205483688/detail.aspx
Наушники Galaxy Buds2 Pro PREMIUM,163530827,1 232 ₽,9 900 ₽,1 207 ₽,https://www.wildberries.ru/catalog/163530827/detail.aspx
Наушники беспроводные большие с микрофоном и шумоподавлением,259977997,718 ₽,4 200 ₽,703 ₽,https://www.wildberries.ru/catalog/259977997/detail.aspx
"Чехол для Marshall Major I, II BT, III, IV, V с ремешком",227580328,371 ₽,870 ₽,363 ₽,https://www.wildberries.ru/catalog/227580328/detail.aspx
Наушники беспроводные с шумоподавлением для Android и Iphone,217459234,692 ₽,3 339 ₽,678 ₽,https://www.wildberries.ru/catalog/217459234/detail.aspx
Наушники беспроводные вакуумные,28076385,578 ₽,2 920 ₽,566 ₽,https://www.wildberries.ru/catalog/28076385/detail.aspx
Наушники беспроводные с микрофоном для Android и Iphone,204536597,692 ₽,3 339 ₽,678 ₽,https://www.wildberries.ru/catalog/204536597/detail.aspx
Наушники беспроводные Air 2 для iPhone и Android,138834549,981 ₽,2 885 ₽,961 ₽,https://www.wildberries.ru/catalog/138834549/detail.aspx
Беспроводные наушники игровые для iPhone и Android,248715787,1 568 ₽,2 999 ₽,1 536 ₽,https://www.wildberries.ru/catalog/248715787/detail.aspx
Наушники проводные игровые usb с микрофоном для компьютера,225254480,2 282 ₽,5 500 ₽,2 236 ₽,https://www.wildberries.ru/catalog/225254480/detail.aspx
Наушники беспроводные большие iphone для андроид,285499452,1 344 ₽,2 999 ₽,1 317 ₽,https://www.wildberries.ru/catalog/285499452/detail.aspx
Беспроводные наушники для андроид и iphone,67573422,941 ₽,1 890 ₽,922 ₽,https://www.wildberries.ru/catalog/67573422/detail.aspx
Наушники беспроводные с микрофоном A.Pods Android iphone,265683039,1 178 ₽,2 958 ₽,1 154 ₽,https://www.wildberries.ru/catalog/265683039/detail.aspx
Наушники проводные с микрофоном большие игровые для пк,283614019,2 604 ₽,6 277 ₽,2 551 ₽,https://www.wildberries.ru/catalog/283614019/detail.aspx
"Гарнитура для рации Баофенг, Кенвуд, наушники для рации",120371467,288 ₽,545 ₽,282 ₽,https://www.wildberries.ru/catalog/120371467/detail.aspx
Наушники беспроводные для iPhone и Android,325958483,775 ₽,2 030 ₽,759 ₽,https://www.wildberries.ru/catalog/325958483/detail.aspx
Наушники беспроводные блютуз спортивные с микрофоном,30464546,1 019 ₽,2 456 ₽,998 ₽,https://www.wildberries.ru/catalog/30464546/detail.aspx
Наушники беспроводные с дисплеем для iPhone Android,260604780,1 642 ₽,2 999 ₽,1 609 ₽,https://www.wildberries.ru/catalog/260604780/detail.aspx
Наушники беспроводные с микрофоном для Android и Iphone,185063902,692 ₽,3 339 ₽,678 ₽,https://www.wildberries.ru/catalog/185063902/detail.aspx
Наушники беспроводные большие iphone для андроид,302513097,1 344 ₽,2 999 ₽,1 317 ₽,https://www.wildberries.ru/catalog/302513097/detail.aspx
Наушники беспроводные с микрофоном для Android и Iphone,185063185,692 ₽,3 339 ₽,678 ₽,https://www.wildberries.ru/catalog/185063185/detail.aspx
"Гарнитура наушник для рации Baofeng, Retevis, Kenwood",105430189,509 ₽,1 097 ₽,498 ₽,https://www.wildberries.ru/catalog/105430189/detail.aspx
"Гарнитура для рации Баофенг, Кенвуд, наушники для рации",143752124,501 ₽,1 139 ₽,490 ₽,https://www.wildberries.ru/catalog/143752124/detail.aspx
Амбушюры-вкладыши для наушников Apple AirPods Pro р. M,131072738,169 ₽,770 ₽,165 ₽,https://www.wildberries.ru/catalog/131072738/detail.aspx
Наушники вакуумные проводные с микрофоном для iPhone,197770943,401 ₽,1 272 ₽,392 ₽,https://www.wildberries.ru/catalog/197770943/detail.aspx
Беспроводные наушники A2 с микрофоном для телефона,34190391,883 ₽,2 639 ₽,865 ₽,https://www.wildberries.ru/catalog/34190391/detail.aspx
Наушники беспроводные с шумоподавлением для Android и Iphone,217458957,665 ₽,3 339 ₽,651 ₽,https://www.wildberries.ru/catalog/217458957/detail.aspx
"Чехол для наушников Marshall Major I, II BT, III, IV, V",161002638,395 ₽,870 ₽,387 ₽,https://www.wildberries.ru/catalog/161002638/detail.aspx
Наушники беспроводные с микрофоном,71906089,579 ₽,9 972 ₽,567 ₽,https://www.wildberries.ru/catalog/71906089/detail.aspx
Galaxy Buds2 Pro PREMIUM,156137683,1 150 ₽,9 900 ₽,1 127 ₽,https://www.wildberries.ru/catalog/156137683/detail.aspx
Наушники проводные с микрофоном,216481088,271 ₽,1 005 ₽,265 ₽,https://www.wildberries.ru/catalog/216481088/detail.aspx
Наушники спортивные беспроводные с шумоподавлением Q25,289461513,1 665 ₽,2 995 ₽,1 631 ₽,https://www.wildberries.ru/catalog/289461513/detail.aspx
Гарнитура блютуз для авто,110433899,695 ₽,1 643 ₽,681 ₽,https://www.wildberries.ru/catalog/110433899/detail.aspx
Наушники беспроводные с микрофоном для Android и Iphone,203874416,663 ₽,1 453 ₽,649 ₽,https://www.wildberries.ru/catalog/203874416/detail.aspx
Наушники беспроводные CityBuds Lite,210707065,1 611 ₽,4 164 ₽,1 578 ₽,https://www.wildberries.ru/catalog/210707065/detail.aspx
Наушники беспроводные с шумоподавлением для телефона,286489071,1 319 ₽,2 999 ₽,1 292 ₽,https://www.wildberries.ru/catalog/286489071/detail.aspx
Наушники беспроводные Air Pro для iPhone и Android блютуз,259781682,1 042 ₽,9 660 ₽,1 021 ₽,https://www.wildberries.ru/catalog/259781682/detail.aspx
Наушники беспроводные большие с микрофоном и шумоподавлением,192586669,1 494 ₽,3 600 ₽,1 464 ₽,https://www.wildberries.ru/catalog/192586669/detail.aspx
Наушники беспроводные с шумоподавлением для Android и Iphone,217459541,692 ₽,3 339 ₽,678 ₽,https://www.wildberries.ru/catalog/217459541/detail.aspx
Наушники проводные iPhone,279754480,623 ₽,5 005 ₽,610 ₽,https://www.wildberries.ru/catalog/279754480/detail.aspx
Наушники беспроводные Airpods pro 2 для iPhone и Android,205380638,1 906 ₽,20 880 ₽,1 867 ₽,https://www.wildberries.ru/catalog/205380638/detail.aspx
"Гарнитура для рации Baofeng UV-9R, наушники для рации",120371468,497 ₽,1 130 ₽,487 ₽,https://www.wildberries.ru/catalog/120371468/detail.aspx
Амбушюры-вкладыши для наушников Apple AirPods Pro р. S,144451874,169 ₽,770 ₽,165 ₽,https://www.wildberries.ru/catalog/144451874/detail.aspx
Наушники беспроводные Air 3 для iPhone Android,202842297,1 418 ₽,2 999 ₽,1 389 ₽,https://www.wildberries.ru/catalog/202842297/detail.aspx
Наушники беспроводные большие с микрофоном и шумоподавлением,325018100,1 616 ₽,2 950 ₽,1 583 ₽,https://www.wildberries.ru/catalog/325018100/detail.aspx
"Ларингофон гарнитура для рации Baofeng, Kenwood, наушники",143752123,1 026 ₽,2 334 ₽,1 005 ₽,https://www.wildberries.ru/catalog/143752123/detail.aspx
"Гарнитура для рации Motorola, наушники для рации Motorola",143759520,540 ₽,1 228 ₽,529 ₽,https://www.wildberries.ru/catalog/143759520/detail.aspx
Наушники беспроводные большие iphone для андроид,302513098,1 344 ₽,2 999 ₽,1 317 ₽,https://www.wildberries.ru/catalog/302513098/detail.aspx
Наушники беспроводные блютуз спортивные с микрофоном A23,30464545,1 019 ₽,2 456 ₽,998 ₽,https://www.wildberries.ru/catalog/30464545/detail.aspx
"Вакуумные наушники Jack 3,5",243690883,359 ₽,783 ₽,351 ₽,https://www.wildberries.ru/catalog/243690883/detail.aspx
Наушники беспроводные AirPods Pro копия Premium+,266932962,663 ₽,9 990 ₽,649 ₽,https://www.wildberries.ru/catalog/266932962/detail.aspx
Наушник беспроводной,171947995,583 ₽,1 497 ₽,571 ₽,https://www.wildberries.ru/catalog/171947995/detail.aspx
Наушники беспроводные Air 2 Black для iPhone и Android,194515456,1 049 ₽,2 940 ₽,1 028 ₽,https://www.wildberries.ru/catalog/194515456/detail.aspx
Наушники беспроводные спортивные OpenAir,210645350,3 250 ₽,8 600 ₽,3 185 ₽,https://www.wildberries.ru/catalog/210645350/detail.aspx
"Гарнитура для рации Баофенг, Кенвуд, наушники для рации",143755403,438 ₽,996 ₽,429 ₽,https://www.wildberries.ru/catalog/143755403/detail.aspx
Беспроводные наушники для iPhone и Android,97906932,437 ₽,1 885 ₽,428 ₽,https://www.wildberries.ru/catalog/97906932/detail.aspx
Наушники беспроводные с микрофоном для Android и Iphone,204537946,660 ₽,1 447 ₽,646 ₽,https://www.wildberries.ru/catalog/204537946/detail.aspx
Наушники беспроводные Airpods pro 2 для iPhone и Android,192542069,2 075 ₽,10 000 ₽,2 033 ₽,https://www.wildberries.ru/catalog/192542069/detail.aspx
Проводные наушники с микрофоном,208549524,347 ₽,1 754 ₽,340 ₽,https://www.wildberries.ru/catalog/208549524/detail.aspx
Наушники беспроводные с микрофоном блютуз Pro,180628759,1 040 ₽,11 400 ₽,1 019 ₽,https://www.wildberries.ru/catalog/180628759/detail.aspx
Наушники беспроводные для iPhone и Android,213442074,439 ₽,1 890 ₽,430 ₽,https://www.wildberries.ru/catalog/213442074/detail.aspx
Чехол для наушников Airpods 4,281880974,200 ₽,1 000 ₽,196 ₽,https://www.wildberries.ru/catalog/281880974/detail.aspx
Наушники беспроводные спортивные с микрофоном,180759447,1 626 ₽,4 000 ₽,1 593 ₽,https://www.wildberries.ru/catalog/180759447/detail.aspx
беспроводные наушники x1 2023,242543236,1 527 ₽,2 000 ₽,1 496 ₽,https://www.wildberries.ru/catalog/242543236/detail.aspx
"Гарнитура для рации Баофенг, Кенвуд, наушники для рации",122174417,375 ₽,853 ₽,367 ₽,https://www.wildberries.ru/catalog/122174417/detail.aspx
"Гарнитура для рации Баофенг, Кенвуд, наушники для рации",133775510,780 ₽,1 774 ₽,764 ₽,https://www.wildberries.ru/catalog/133775510/detail.aspx
Наушники беспроводные Air 2 Black для iPhone и Android,208488443,1 047 ₽,2 868 ₽,1 026 ₽,https://www.wildberries.ru/catalog/208488443/detail.aspx
Силиконовые амбушюры сменные комплект 3 размера,198423149,142 ₽,200 ₽,139 ₽,https://www.wildberries.ru/catalog/198423149/detail.aspx
Наушники беспроводные A.Pods Pro 2 копия люкс,270500124,1 143 ₽,1 984 ₽,1 120 ₽,https://www.wildberries.ru/catalog/270500124/detail.aspx
Наушники беспроводные спортивные с микрофоном,180770057,1 626 ₽,4 000 ₽,1 593 ₽,https://www.wildberries.ru/catalog/180770057/detail.aspx
Беспроводные наушники Pro 2,176929631,324 ₽,1 343 ₽,317 ₽,https://www.wildberries.ru/catalog/176929631/detail.aspx
"Чехол для Airpods 1, 2",207078424,339 ₽,740 ₽,332 ₽,https://www.wildberries.ru/catalog/207078424/detail.aspx
Наушники проводные Iphone с микрофоном Lightning,217303439,315 ₽,700 ₽,308 ₽,https://www.wildberries.ru/catalog/217303439/detail.aspx
Наушники магнитные Type-C с микрофоном,237282874,484 ₽,1 620 ₽,474 ₽,https://www.wildberries.ru/catalog/237282874/detail.aspx
Наушники Type-C PRO с микрофоном,222150259,483 ₽,1 822 ₽,473 ₽,https://www.wildberries.ru/catalog/222150259/detail.aspx
Наушники беспроводные большие с микрофоном и шумоподавлением,286571308,2 060 ₽,4 966 ₽,2 018 ₽,https://www.wildberries.ru/catalog/286571308/detail.aspx
Подставка для наушников,302049382,428 ₽,1 999 ₽,419 ₽,https://www.wildberries.ru/catalog/302049382/detail.aspx
Наушники беспроводные Air 2 для iPhone Android,190819363,1 194 ₽,2 999 ₽,1 170 ₽,https://www.wildberries.ru/catalog/190819363/detail.aspx
"Наушники беспроводные FreeClip, Фиолетовый",245073121,14 939 ₽,24 999 ₽,14 640 ₽,https://www.wildberries.ru/catalog/245073121/detail.aspx
Наушники беспроводные с микрофоном для андроид и iphone,284282584,1 254 ₽,2 500 ₽,1 228 ₽,https://www.wildberries.ru/catalog/284282584/detail.aspx
Чехол для Airpods Pro 2 из экокожи с подвеской PU leather,303425073,1 303 ₽,2 490 ₽,1 276 ₽,https://www.wildberries.ru/catalog/303425073/detail.aspx
"Гарнитура для рации Баофенг, Кенвуд, наушники для рации",122174416,662 ₽,1 507 ₽,648 ₽,https://www.wildberries.ru/catalog/122174416/detail.aspx
Наушники беспроводные Airpods 3 для iPhone и android,262348519,1 482 ₽,8 928 ₽,1 452 ₽,https://www.wildberries.ru/catalog/262348519/detail.aspx
Наушники беспроводные AirPods Pro 2 для iPhone Android,264199758,660 ₽,2 150 ₽,646 ₽,https://www.wildberries.ru/catalog/264199758/detail.aspx
Наушники беспроводные AirPods 2 для iPhone и Android,183586670,995 ₽,4 999 ₽,975 ₽,https://www.wildberries.ru/catalog/183586670/detail.aspx
Подставка держатель для наушников и телефона,221319831,527 ₽,1 426 ₽,516 ₽,https://www.wildberries.ru/catalog/221319831/detail.aspx
Наушники проводные для телефона,177688040,335 ₽,1 330 ₽,328 ₽,https://www.wildberries.ru/catalog/177688040/detail.aspx
Наушники проводные с микрофоном,139813765,196 ₽,676 ₽,192 ₽,https://www.wildberries.ru/catalog/139813765/detail.aspx
Наушники беспроводные с шумоподавлением для Android и Iphone,217459394,673 ₽,1 475 ₽,659 ₽,https://www.wildberries.ru/catalog/217459394/detail.aspx
Наушники проводные,74486867,405 ₽,1 193 ₽,396 ₽,https://www.wildberries.ru/catalog/74486867/detail.aspx
Силиконовый чехол для AirPods 4,294665309,289 ₽,965 ₽,283 ₽,https://www.wildberries.ru/catalog/294665309/detail.aspx
Наушники,297418704,3 735 ₽,10 000 ₽,3 660 ₽,https://www.wildberries.ru/catalog/297418704/detail.aspx
Чехол на Apple Airpods 1 / 2,246153787,324 ₽,1 200 ₽,317 ₽,https://www.wildberries.ru/catalog/246153787/detail.aspx
Наушники проводные Type-C с микрофоном,12340740,399 ₽,1 058 ₽,391 ₽,https://www.wildberries.ru/catalog/12340740/detail.aspx
"Чехол для наушников, проводов USB и ключей на молнии",311537350,216 ₽,1 200 ₽,211 ₽,https://www.wildberries.ru/catalog/311537350/detail.aspx
Беспроводные наушники игровые блютуз микрофон Андроид iPhone,43450373,1 019 ₽,3 070 ₽,998 ₽,https://www.wildberries.ru/catalog/43450373/detail.aspx
Наушники беспроводные A. Pods Pro 2 для iPhone Android,204577998,1 294 ₽,3 250 ₽,1 268 ₽,https://www.wildberries.ru/catalog/204577998/detail.aspx
Наушники проводные с микрофоном,266564027,280 ₽,1 002 ₽,274 ₽,https://www.wildberries.ru/catalog/266564027/detail.aspx
Наушники беспроводные Air Pro для iPhone и Android блютуз,317606262,1 189 ₽,1 990 ₽,1 165 ₽,https://www.wildberries.ru/catalog/317606262/detail.aspx
Игровые наушники проводные для ПК PANTEON GHP-970 PRO Black,231719544,3 286 ₽,6 000 ₽,3 220 ₽,https://www.wildberries.ru/catalog/231719544/detail.aspx
Наушники беспроводные с шумоподавлением для телефона,256051362,1 393 ₽,2 999 ₽,1 365 ₽,https://www.wildberries.ru/catalog/256051362/detail.aspx
Наушники беспроводные A Pods Pro 2 для iPhone Android,298996249,1 624 ₽,12 232 ₽,1 591 ₽,https://www.wildberries.ru/catalog/298996249/detail.aspx
Наушники беспроводные с шумоподавлением,140851046,2 173 ₽,2 976 ₽,2 129 ₽,https://www.wildberries.ru/catalog/140851046/detail.aspx
Наушники беспроводные большие iphone для андроид,311629727,1 344 ₽,2 999 ₽,1 317 ₽,https://www.wildberries.ru/catalog/311629727/detail.aspx
Наушники беспроводные с шумоподавлением,231976848,2 645 ₽,10 990 ₽,2 592 ₽,https://www.wildberries.ru/catalog/231976848/detail.aspx
Микронаушники магнитные запасной набор,161200607,297 ₽,600 ₽,291 ₽,https://www.wildberries.ru/catalog/161200607/detail.aspx
Наушники беспроводные сенсорные,217429032,755 ₽,5 055 ₽,739 ₽,https://www.wildberries.ru/catalog/217429032/detail.aspx
"Чехол для AirPods Pro 1, 2",78330604,311 ₽,494 ₽,304 ₽,https://www.wildberries.ru/catalog/78330604/detail.aspx
Наушники проводные с микрофоном,216478374,261 ₽,1 005 ₽,255 ₽,https://www.wildberries.ru/catalog/216478374/detail.aspx
Игровые наушники проводные с микрофоном,299480150,2 763 ₽,4 500 ₽,2 707 ₽,https://www.wildberries.ru/catalog/299480150/detail.aspx
"Чехол для наушников AirPods PRO, чехол на Air Pods PRO 2",209474524,224 ₽,488 ₽,219 ₽,https://www.wildberries.ru/catalog/209474524/detail.aspx
Гарнитура беспроводная Bluetooth v.5.0,14338753,814 ₽,2 002 ₽,797 ₽,https://www.wildberries.ru/catalog/14338753/detail.aspx
Наушники беспроводные с микрофоном для iphone для андроид,221799727,1 027 ₽,1 997 ₽,1 006 ₽,https://www.wildberries.ru/catalog/221799727/detail.aspx
Наушники беспроводные Air 2 для iPhone и Android,158558705,925 ₽,2 934 ₽,906 ₽,https://www.wildberries.ru/catalog/158558705/detail.aspx
Проводные наушники MDR-EX15LP. Оригинал. Вьетнам.,160962223,1 214 ₽,1 590 ₽,1 189 ₽,https://www.wildberries.ru/catalog/160962223/detail.aspx
Подставка для наушников,225878509,442 ₽,830 ₽,433 ₽,https://www.wildberries.ru/catalog/225878509/detail.aspx
