"Игровые наушники Scarab с гибкий микрофоном, модель GHS-X30",60647843,1 541 ₽,3 790 ₽,1 510 ₽,https://www.wildberries.ru/catalog/60647843/detail.aspx
"Наушники беспроводные TWS, модель HB-555",64981673,1 912 ₽,4 190 ₽,1 873 ₽,https://www.wildberries.ru/catalog/64981673/detail.aspx
Чехол для наушников Apple AirPods 3 кольцо с карабином,43864400,626 ₽,2 796 ₽,613 ₽,https://www.wildberries.ru/catalog/43864400/detail.aspx
Беспроводные наушники Bluetooth,190312479,605 ₽,7 300 ₽,592 ₽,https://www.wildberries.ru/catalog/190312479/detail.aspx
Подставка держатель для наушников,211488164,459 ₽,757 ₽,449 ₽,https://www.wildberries.ru/catalog/211488164/detail.aspx
Микронаушник магнитный Bluetooth B1 аккумуляторный,100845883,2 975 ₽,39 830 ₽,2 915 ₽,https://www.wildberries.ru/catalog/100845883/detail.aspx
Беспроводные вакуумные наушники блютуз,186737588,637 ₽,2 400 ₽,624 ₽,https://www.wildberries.ru/catalog/186737588/detail.aspx
Наушники беспроводные с микрофоном BH100,67573419,771 ₽,1 690 ₽,755 ₽,https://www.wildberries.ru/catalog/67573419/detail.aspx
Наушники Bluetooth TWS HB-551 Lime,277218137,890 ₽,2 190 ₽,872 ₽,https://www.wildberries.ru/catalog/277218137/detail.aspx
Наушники проводные с микрофоном,305619960,280 ₽,1 002 ₽,274 ₽,https://www.wildberries.ru/catalog/305619960/detail.aspx
Наушники беспроводные Galaxy Buds Pro,257860762,776 ₽,1 990 ₽,760 ₽,https://www.wildberries.ru/catalog/257860762/detail.aspx
Беспроводные наушники с TWS F9-5,175577880,617 ₽,1 730 ₽,604 ₽,https://www.wildberries.ru/catalog/175577880/detail.aspx
Наушники беспроводные AirPro 2 для iPhone Android,209928876,1 161 ₽,1 999 ₽,1 137 ₽,https://www.wildberries.ru/catalog/209928876/detail.aspx
Наушники беспроводные с микрофоном BH100,67573420,771 ₽,1 690 ₽,755 ₽,https://www.wildberries.ru/catalog/67573420/detail.aspx
Микронаушник с 2 микрофонами подключаемый с кнопкой пищалкой,233634654,2 614 ₽,9 000 ₽,2 561 ₽,https://www.wildberries.ru/catalog/233634654/detail.aspx
Микронаушник с подключаемым микрофоном и кнопкой пищалкой,233635167,2 917 ₽,9 500 ₽,2 858 ₽,https://www.wildberries.ru/catalog/233635167/detail.aspx
Накладки на наушники AirPods Pro 2 EarBuds Cover (3 sets),162690020,1 532 ₽,2 790 ₽,1 501 ₽,https://www.wildberries.ru/catalog/162690020/detail.aspx
Гарнитура 64113,265823413,963 ₽,1 470 ₽,943 ₽,https://www.wildberries.ru/catalog/265823413/detail.aspx
Чехол на AirPods 4 силиконовый с карабином,282384388,327 ₽,600 ₽,320 ₽,https://www.wildberries.ru/catalog/282384388/detail.aspx
Амбушюры для наушников Beats Studio 2.0/Studio 3.0,35600189,609 ₽,1 199 ₽,596 ₽,https://www.wildberries.ru/catalog/35600189/detail.aspx
"Наушники беспроводные, 30/300мАч, индикатор заряда, красный",260207090,1 234 ₽,1 487 ₽,1 209 ₽,https://www.wildberries.ru/catalog/260207090/detail.aspx
Гарнитура Bluetooth,233467814,1 005 ₽,2 540 ₽,984 ₽,https://www.wildberries.ru/catalog/233467814/detail.aspx
Док станция для зарядки умных часов Huawei Honor S1,25774447,389 ₽,1 427 ₽,381 ₽,https://www.wildberries.ru/catalog/25774447/detail.aspx
Наушники беспроводные Air Pro для iPhone и Android блютуз,151264534,846 ₽,8 499 ₽,829 ₽,https://www.wildberries.ru/catalog/151264534/detail.aspx
"Беспроводные Bluetooth 5.0 наушники, HB-712",50394538,2 110 ₽,5 190 ₽,2 067 ₽,https://www.wildberries.ru/catalog/50394538/detail.aspx
Наушники беспроводные A.Pods2 для iPhone Android,205447945,763 ₽,1 999 ₽,747 ₽,https://www.wildberries.ru/catalog/205447945/detail.aspx
Наушники проводные с микрофоном Type-c,217301841,298 ₽,850 ₽,292 ₽,https://www.wildberries.ru/catalog/217301841/detail.aspx
Силиконовые амбушюры сменные комплект 3 размера,198423542,162 ₽,200 ₽,158 ₽,https://www.wildberries.ru/catalog/198423542/detail.aspx
Наушники беспроводные игровые для iphone android и ПК,173957820,1 436 ₽,1 990 ₽,1 407 ₽,https://www.wildberries.ru/catalog/173957820/detail.aspx
Наушники беспроводные Airpods Pro 2 реплика c микрофоном,239419435,2 050 ₽,10 740 ₽,2 009 ₽,https://www.wildberries.ru/catalog/239419435/detail.aspx
Наушники проводные Lightning с микрофоном,190443909,260 ₽,400 ₽,254 ₽,https://www.wildberries.ru/catalog/190443909/detail.aspx
Микронаушник магнитный Bluetooth с пищалкой,189725427,3 409 ₽,82 160 ₽,3 340 ₽,https://www.wildberries.ru/catalog/189725427/detail.aspx
Наушники беспроводные AirPods 3 для iPhone и Android,216296339,1 220 ₽,7 000 ₽,1 195 ₽,https://www.wildberries.ru/catalog/216296339/detail.aspx
Мультифункциональная зарядная станция 6 в 1,266443601,900 ₽,1 800 ₽,882 ₽,https://www.wildberries.ru/catalog/266443601/detail.aspx
Мультифункциональная зарядная станция 6 в 1,266443600,900 ₽,1 800 ₽,882 ₽,https://www.wildberries.ru/catalog/266443600/detail.aspx
Наушники беспроводные Airpods pro 2 для iPhone и Android,152560914,2 096 ₽,10 980 ₽,2 054 ₽,https://www.wildberries.ru/catalog/152560914/detail.aspx
Беспроводные наушники для iPhone и Android,234078420,382 ₽,2 500 ₽,374 ₽,https://www.wildberries.ru/catalog/234078420/detail.aspx
Наушники беспроводные A. Pods Pro 2 для iPhone Android,290916842,2 107 ₽,5 520 ₽,2 064 ₽,https://www.wildberries.ru/catalog/290916842/detail.aspx
Универсальные амбушюры утолщенные для наушников 95 мм (Кожа),204698281,665 ₽,1 622 ₽,651 ₽,https://www.wildberries.ru/catalog/204698281/detail.aspx
Наушники беспроводные игровые для iphone и андроид,240725355,799 ₽,1 999 ₽,783 ₽,https://www.wildberries.ru/catalog/240725355/detail.aspx
Наушники беспроводные Galaxy Buds Pro,257861103,759 ₽,1 990 ₽,743 ₽,https://www.wildberries.ru/catalog/257861103/detail.aspx
"Гарнитура MHS-786, регулятор громкости",30289034,756 ₽,1 982 ₽,740 ₽,https://www.wildberries.ru/catalog/30289034/detail.aspx
Микронаушник магнитный кабель,316119121,279 ₽,500 ₽,273 ₽,https://www.wildberries.ru/catalog/316119121/detail.aspx
беспроводные наушники Airpods (2-го поколения),154103029,810 ₽,18 000 ₽,793 ₽,https://www.wildberries.ru/catalog/154103029/detail.aspx
Беспроводные вакуумные наушники блютуз с шумоподавлением,226478179,281 ₽,1 490 ₽,275 ₽,https://www.wildberries.ru/catalog/226478179/detail.aspx
Силиконовый чехол накладка на наушники Apple Airpods Max Y2K,270895635,450 ₽,1 110 ₽,441 ₽,https://www.wildberries.ru/catalog/270895635/detail.aspx
Наушники беспроводные для iPhone и Android,77045756,377 ₽,5 999 ₽,369 ₽,https://www.wildberries.ru/catalog/77045756/detail.aspx
Наушники беспроводные с микрофоном Pro3 Android iphone,145726284,1 408 ₽,2 978 ₽,1 379 ₽,https://www.wildberries.ru/catalog/145726284/detail.aspx
Наушники беспроводные Air 2 для iPhone и Android,223314406,804 ₽,1 700 ₽,787 ₽,https://www.wildberries.ru/catalog/223314406/detail.aspx
Чехол на наушники airpods 4 аирподс 4 силиконовый матовый,288900530,369 ₽,1 000 ₽,361 ₽,https://www.wildberries.ru/catalog/288900530/detail.aspx
Наушники беспроводные спортивные с микрофоном bluetooth,173937886,1 139 ₽,1 990 ₽,1 116 ₽,https://www.wildberries.ru/catalog/173937886/detail.aspx
Наушники беспроводные Airpods Pro 2 с шумоподавлением,177718586,1 570 ₽,8 600 ₽,1 538 ₽,https://www.wildberries.ru/catalog/177718586/detail.aspx
Наушники беспроводные с микрофоном для iphone для андроид,161696172,967 ₽,1 975 ₽,947 ₽,https://www.wildberries.ru/catalog/161696172/detail.aspx
"Гарнитура, регулятор громкости MHS-782",14726920,825 ₽,2 116 ₽,808 ₽,https://www.wildberries.ru/catalog/14726920/detail.aspx
Наушники беспроводные большие для iphone для телевизора,245763655,1 294 ₽,2 999 ₽,1 268 ₽,https://www.wildberries.ru/catalog/245763655/detail.aspx
Игровые наушники для компьютера PANTEON GHP-270 PRO,170470201,2 596 ₽,4 600 ₽,2 544 ₽,https://www.wildberries.ru/catalog/170470201/detail.aspx
Наушники беспроводные iPhone Android Airpods Pro 2 Type-C,267734850,2 622 ₽,7 900 ₽,2 569 ₽,https://www.wildberries.ru/catalog/267734850/detail.aspx
Магнитный Bluetooth микронаушник с пищалкой,138216345,3 231 ₽,6 649 ₽,3 166 ₽,https://www.wildberries.ru/catalog/138216345/detail.aspx
Наушники беспроводные с микрофоном спортивные стерео,141393439,757 ₽,1 690 ₽,741 ₽,https://www.wildberries.ru/catalog/141393439/detail.aspx
Наушники беспроводные A.p 3 Premium NEW-2024,211436871,680 ₽,1 999 ₽,666 ₽,https://www.wildberries.ru/catalog/211436871/detail.aspx
наушники беспроводные,235091194,1 234 ₽,12 465 ₽,1 209 ₽,https://www.wildberries.ru/catalog/235091194/detail.aspx
Блютуз гарнитура для компьютера с микрофоном bluetooth,190025489,3 236 ₽,5 908 ₽,3 171 ₽,https://www.wildberries.ru/catalog/190025489/detail.aspx
Airpods Pro,257852046,595 ₽,2 990 ₽,583 ₽,https://www.wildberries.ru/catalog/257852046/detail.aspx
Наушники детские беcпроводные блютуз с микрофоном,35519474,329 ₽,1 050 ₽,322 ₽,https://www.wildberries.ru/catalog/35519474/detail.aspx
"Наушники проводные G19, с микрофоном",194511194,458 ₽,688 ₽,448 ₽,https://www.wildberries.ru/catalog/194511194/detail.aspx
Наушники игровые проводные MHS-GX15,53841757,1 992 ₽,4 802 ₽,1 952 ₽,https://www.wildberries.ru/catalog/53841757/detail.aspx
Беспроводные наушники для iPhone и Android,200362963,392 ₽,1 890 ₽,384 ₽,https://www.wildberries.ru/catalog/200362963/detail.aspx
Наушники беспроводные Air2 черные для iPhone Android,248956391,978 ₽,1 999 ₽,958 ₽,https://www.wildberries.ru/catalog/248956391/detail.aspx
Беспроводные bluetooth наушники для телефона,272727341,779 ₽,5 220 ₽,763 ₽,https://www.wildberries.ru/catalog/272727341/detail.aspx
Чехол для наушников Airpods 4,281878302,200 ₽,1 000 ₽,196 ₽,https://www.wildberries.ru/catalog/281878302/detail.aspx
Амбушюры и крепление держатели для беспроводных наушников,150664124,160 ₽,320 ₽,156 ₽,https://www.wildberries.ru/catalog/150664124/detail.aspx
Наушники беспроводные Airpods 3 для iPhone и android,259666475,1 105 ₽,9 514 ₽,1 082 ₽,https://www.wildberries.ru/catalog/259666475/detail.aspx
"Игровые наушники, гарнитура",184015490,1 513 ₽,7 600 ₽,1 482 ₽,https://www.wildberries.ru/catalog/184015490/detail.aspx
Наушники беспроводные A2 для iPhone Android,211435573,763 ₽,1 999 ₽,747 ₽,https://www.wildberries.ru/catalog/211435573/detail.aspx
Беспроводные TWS наушники Xiaomi Buds 4 Active,313229596,977 ₽,1 240 ₽,957 ₽,https://www.wildberries.ru/catalog/313229596/detail.aspx
Амбушюры накладки для AirPods pro и pro2,245403958,340 ₽,1 420 ₽,333 ₽,https://www.wildberries.ru/catalog/245403958/detail.aspx
Беспроводные наушники блютуз с микрофоном,137588491,1 007 ₽,1 957 ₽,986 ₽,https://www.wildberries.ru/catalog/137588491/detail.aspx
Чехол для наушников HONOR X3 с карабином,177233459,306 ₽,1 000 ₽,299 ₽,https://www.wildberries.ru/catalog/177233459/detail.aspx
Силиконовый чехол для BOSE Ultra Open Earbuds с карабином,256295497,288 ₽,1 000 ₽,282 ₽,https://www.wildberries.ru/catalog/256295497/detail.aspx
Наушники проводные с микрофоном Type-C 1.2м,190443910,232 ₽,400 ₽,227 ₽,https://www.wildberries.ru/catalog/190443910/detail.aspx
Наушники беспроводные игровые с микрофоном bluetooth,173943230,1 007 ₽,1 990 ₽,986 ₽,https://www.wildberries.ru/catalog/173943230/detail.aspx
Наушники беспроводные для андроид телефона,311639103,773 ₽,2 166 ₽,757 ₽,https://www.wildberries.ru/catalog/311639103/detail.aspx
Чехол для наушников Маршалл больших накладных,178193541,574 ₽,2 002 ₽,562 ₽,https://www.wildberries.ru/catalog/178193541/detail.aspx
"Наушники беспроводные 2.0, вкладыши",181319992,3 309 ₽,11 394 ₽,3 242 ₽,https://www.wildberries.ru/catalog/181319992/detail.aspx
Беспроводные Bluetooth-наушники/KSC-388/c микрофоном,76781845,2 631 ₽,7 902 ₽,2 578 ₽,https://www.wildberries.ru/catalog/76781845/detail.aspx
Чехол для наушников Realme Buds T100 с карабином,300366707,270 ₽,1 001 ₽,264 ₽,https://www.wildberries.ru/catalog/300366707/detail.aspx
Наушники беспроводные AirPods 4 для iPhone и Android Pods4,290284034,1 820 ₽,12 901 ₽,1 783 ₽,https://www.wildberries.ru/catalog/290284034/detail.aspx
Наушники беспроводные,158657137,323 ₽,2 999 ₽,316 ₽,https://www.wildberries.ru/catalog/158657137/detail.aspx
Наушники беспроводные,222604921,776 ₽,8 500 ₽,760 ₽,https://www.wildberries.ru/catalog/222604921/detail.aspx
Наушники беспроводные TWE-20,194189914,1 705 ₽,2 740 ₽,1 670 ₽,https://www.wildberries.ru/catalog/194189914/detail.aspx
Игровые наушники проводные с микрофоном для компьютера,313207175,1 285 ₽,1 630 ₽,1 259 ₽,https://www.wildberries.ru/catalog/313207175/detail.aspx
Беспроводные Наушники Air 2 для iPhone и Android,220711134,1 328 ₽,20 000 ₽,1 301 ₽,https://www.wildberries.ru/catalog/220711134/detail.aspx
Наушники беспроводные с микрофоном Pro 2 для iPhone Android,248314027,1 164 ₽,2 300 ₽,1 140 ₽,https://www.wildberries.ru/catalog/248314027/detail.aspx
Наушники беспроводные большие,209664514,1 284 ₽,3 096 ₽,1 258 ₽,https://www.wildberries.ru/catalog/209664514/detail.aspx
Наушники с микрофоном Luzon RX-13 черные 1.5 м,277260324,561 ₽,1 248 ₽,549 ₽,https://www.wildberries.ru/catalog/277260324/detail.aspx
Наушники проводные с микрофоном вакуумные Xiaomi Pushbox,114707364,523 ₽,1 262 ₽,512 ₽,https://www.wildberries.ru/catalog/114707364/detail.aspx
"Чехол Soft touch для кейса Apple AirPods, цвет бежевый, 1",119996322,324 ₽,600 ₽,317 ₽,https://www.wildberries.ru/catalog/119996322/detail.aspx
Гарнитура блютуз для телефона водителю,264568842,781 ₽,2 004 ₽,765 ₽,https://www.wildberries.ru/catalog/264568842/detail.aspx
Наушники беспроводные блютуз Air 3 с микрофоном,257662701,921 ₽,2 777 ₽,902 ₽,https://www.wildberries.ru/catalog/257662701/detail.aspx
Микронаушник для экзамена магнитный Bluetooth Premium,229233018,2 359 ₽,9 170 ₽,2 311 ₽,https://www.wildberries.ru/catalog/229233018/detail.aspx
